{
  "number": 2,
  "band": 3,
  "title": "The Wrong Rooms",
  "pages": [
    "The stronghold is wrong.\n\nNot damaged. Wrong.\n\nThe corridors connect to rooms that shouldn't exist, and rooms lead back to themselves.\n\nI marked one with a torch.\n\nWhen I came back, the torch was on the other side of the room.",
    "I found my footprints.\n\nThey were ahead of me.\n\nI checked the boots.\n\nMine.\n\nI followed them.\n\nThey ended where I was standing.",
    "There is something underneath the stone.\n\nIt isn't a mob.\n\nI know what mobs sound like.\n\nThis sounds like something trying to remember how to breathe."
  ]
}
