{
  "number": 22,
  "band": 27,
  "title": "Three Heads",
  "pages": [
    "A keep of soul sand and old brick, past the last bridge.\n\nSkeletons stand in the walls as if they had been built into them, and perhaps they were.",
    "He made a thing here once. Three skulls, four blocks of soul sand, and a patience I never had.\n\nHe said a hero should know what he can kill. He never said what it costs to keep the pieces.",
    "It rises. It always rises. Do not stand near the centre when it does.\n\nI did, the first time. I will not tell you what that taught me."
  ]
}
