{
  "number": 8,
  "band": 13,
  "title": "The First Pick",
  "pages": [
    "The first cave I found had timbers in it.\n\nOld planks. Fence posts. A rail running off into the dark.\n\nHe had built this. Years ago, when he still knew what a mine was for.\n\nI took what the walls gave me. It felt like borrowing."
  ]
}
